{
    "RESOURCES":
    {
        "AUDIO_ALARM": "assets/wake_up.wav"
    },
    "THRESHOLDS":
    {
        "EAR_THRESH": [0.0, 0.4, 0.18, 0.01],
        "HEAD_THRESH": [0.0, 25.0, 15.0, 0.5],
        "DROWSY_THRESH": [0.0, 30.0, 15.0, 1.0],
        "WAIT_TIME": [0.0, 5.0, 1.0, 0.25]
    },
    "WEBRTC":
    {
        "KEY": "drowsiness-detection",
        "VIDEO_HEIGHT": 480
    },
    "DETECTION":
    {
        "MEDIAPIPE":
        {
            "MAX_FACES": 1,
            "MIN_FACE_DETECTION_CONFIDENCE": 0.5,
            "MIN_FACE_TRACKING_CONFIDENCE": 0.5
        },
        "OPENVINO":
        {
            "HEAD":
            {
                "IR": "models/head-pose-estimation-adas-0001/head-pose-estimation-adas-0001.xml",
                "WEIGHTS": "models/head-pose-estimation-adas-0001/head-pose-estimation-adas-0001.bin",
                "INPUT_NAME": "data",
                "OUTPUT_NAME": "angle_y_fc"
            },
            "DROWSY":
            {
                "IR": "models/mobilenetv3/mobilenet_v3_large.xml",
                "WEIGHTS": "models/mobilenetv3/mobilenet_v3_large.bin",
                "INPUT_NAME": "input.1",
                "OUTPUT_NAME": "519"
            },
            "HEAD_POS_MODEL": "models/head-pose-estimation-adas-0001/head-pose-estimation-adas-0001.xml",
            "HEAD_POS_MODEL_WEIGHTS": "models/head-pose-estimation-adas-0001/head-pose-estimation-adas-0001.bin",
            "DROWSY_MODEL": "models/mobilenetv3/mobilenet_v3_large.xml",
            "DROWSY_MODEL_WEIGHTS": "models/mobilenetv3/mobilenet_v3_large.bin"
        },
        "EAR":
        {
            "LANDMARKS":
            {
                "LEFT": [362, 385, 387, 263, 373, 380],
                "RIGHT": [33, 160, 158, 133, 153, 144]
            }
        }
    }
}